URL,Version,Status,OIDs,Name,Title,Description,Used
http://terminology.hl7.org/CodeSystem/communication-not-done-reason,1.0.1,active,"2.16.840.1.113883.4.642.1.1077",CommunicationNotDoneReason,CommunicationNotDoneReason,"Codes for the reason why a communication did not happen.","ValueSet/communication-not-done-reason"
http://terminology.hl7.org/CodeSystem/condition-category,2.0.0,active,"2.16.840.1.113883.4.642.1.1073",ConditionCategoryCodes,Condition Category Codes,"Preferred value set for Condition Categories.","ValueSet/condition-category"
http://terminology.hl7.org/CodeSystem/condition-clinical,3.0.0,active,"2.16.840.1.113883.4.642.1.1074",ConditionClinicalStatusCodes,Condition Clinical Status Codes,"Preferred value set for Condition Clinical Status.","ValueSet/condition-clinical"
http://terminology.hl7.org/CodeSystem/condition-ver-status,2.0.1,active,"2.16.840.1.113883.4.642.1.1075",ConditionVerificationStatus,ConditionVerificationStatus,"The verification status to support or decline the clinical status of the condition or diagnosis.","ValueSet/condition-ver-status"
http://terminology.hl7.org/CodeSystem/contactentity-type,2.0.0,active,"2.16.840.1.113883.4.642.1.1129",ContactEntityType,Contact entity type,"This example value set defines a set of codes that can be used to indicate the purpose for which you would contact a contact party.","ValueSet/contactentity-type"
http://terminology.hl7.org/CodeSystem/coverageeligibilityresponse-ex-auth-support,1.0.1,active,"2.16.840.1.113883.4.642.1.1394",CoverageEligibilityResponseAuthSupportCodes,CoverageEligibilityResponse Auth Support Codes,"This value set includes CoverageEligibilityResponse Auth Support codes.","ValueSet/coverageeligibilityresponse-ex-auth-support"
http://terminology.hl7.org/CodeSystem/data-absent-reason,1.0.0,active,"2.16.840.1.113883.4.642.4.1048",DataAbsentReason,DataAbsentReason,"Used to specify why the normally expected content of the data element is missing.","ValueSet/data-absent-reason"
http://terminology.hl7.org/CodeSystem/diagnosis-role,1.1.1,active,"2.16.840.1.113883.4.642.1.1054",DiagnosisRole,Diagnosis Role,"This value set defines a set of codes that can be used to express the role of a diagnosis on the Encounter or EpisodeOfCare record.","ValueSet/diagnosis-role"
http://terminology.hl7.org/CodeSystem/episodeofcare-type,1.0.1,active,"2.16.840.1.113883.4.642.1.1189",EpisodeOfCareType,Episode of care type,"This example value set defines a set of codes that can be used to express the usage type of an EpisodeOfCare record.","ValueSet/episodeofcare-type"
http://terminology.hl7.org/CodeSystem/ex-USCLS,1.0.0,draft,"2.16.840.1.113883.4.642.1.1153",USCLSCodes,USCLS Codes,"This value set includes a smattering of USCLS codes.","ValueSet/service-uscls"
http://terminology.hl7.org/CodeSystem/ex-benefitcategory,1.0.1,active,"2.16.840.1.113883.4.642.1.1175",BenefitCategoryCodes,Benefit Category Codes,"This value set includes examples of Benefit Category codes.","ValueSet/ex-benefitcategory"
http://terminology.hl7.org/CodeSystem/ex-claimsubtype,1.0.1,active,"2.16.840.1.113883.4.642.1.1158",ExampleClaimSubTypeCodes,Example Claim SubType Codes,"This value set includes sample Claim SubType codes which are used to distinguish the claim types for example within type institutional there may be subtypes for emergency services, bed stay and transportation.","ValueSet/claim-subtype"
http://terminology.hl7.org/CodeSystem/ex-diagnosis-on-admission,1.0.1,active,"2.16.840.1.113883.4.642.1.1170",ExampleDiagnosisOnAdmissionCodes,Example Diagnosis on Admission Codes,"This value set includes example Diagnosis on Admission codes.","ValueSet/ex-diagnosis-on-admission"
http://terminology.hl7.org/CodeSystem/ex-diagnosisrelatedgroup,1.0.1,active,"2.16.840.1.113883.4.642.1.1166",ExampleDiagnosisRelatedGroupCodes,Example Diagnosis Related Group Codes,"This value set includes example Diagnosis Related Group codes.","ValueSet/ex-diagnosisrelatedgroup"
http://terminology.hl7.org/CodeSystem/ex-diagnosistype,1.0.1,active,"2.16.840.1.113883.4.642.1.1167",ExampleDiagnosisTypeCodes,Example Diagnosis Type Codes,"This value set includes example Diagnosis Type codes.","ValueSet/ex-diagnosistype"
http://terminology.hl7.org/CodeSystem/ex-paymenttype,1.0.1,active,"2.16.840.1.113883.4.642.1.1181",ExamplePaymentTypeCodes,Example Payment Type Codes,"This value set includes example Payment Type codes.","ValueSet/ex-paymenttype"
http://terminology.hl7.org/CodeSystem/ex-procedure-type,1.0.1,active,"2.16.840.1.113883.4.642.1.1388",ExampleProcedureTypeCodes,Example Procedure Type Codes,"This value set includes example Procedure Type codes.","ValueSet/ex-procedure-type"
http://terminology.hl7.org/CodeSystem/ex-programcode,1.0.1,active,"2.16.840.1.113883.4.642.1.1161",ExampleProgramReasonCodes,Example Program Reason Codes,"This value set includes sample Program Reason Span codes.","ValueSet/ex-program-code"
http://terminology.hl7.org/CodeSystem/ex-providerqualification,1.0.1,active,"2.16.840.1.113883.4.642.1.1160",ExampleProviderQualificationCodes,Example Provider Qualification Codes,"This value set includes sample Provider Qualification codes.","ValueSet/provider-qualification"
http://terminology.hl7.org/CodeSystem/ex-relatedclaimrelationship,1.0.1,active,"2.16.840.1.113883.4.642.1.1159",ExampleRelatedClaimRelationshipCodes,Example Related Claim Relationship Codes,"This value set includes sample Related Claim Relationship codes.","ValueSet/related-claim-relationship"
http://terminology.hl7.org/CodeSystem/ex-revenue-center,1.0.1,active,"2.16.840.1.113883.4.642.1.1168",ExampleRevenueCenterCodes,Example Revenue Center Codes,"This value set includes sample Revenue Center codes.","ValueSet/ex-revenue-center"
http://terminology.hl7.org/CodeSystem/ex-serviceplace,1.0.1,active,"2.16.840.1.113883.4.642.1.1157",ExampleServicePlaceCodes,Example Service Place Codes,"This value set includes a smattering of Service Place codes.","ValueSet/service-place"
http://terminology.hl7.org/CodeSystem/ex-tooth,1.0.0,draft,"2.16.840.1.113883.4.642.1.1152",OralSiteCodes,Oral Site Codes,"This value set includes a smattering of FDI oral site codes.","ValueSet/tooth"
http://terminology.hl7.org/CodeSystem/forms-codes,1.0.1,active,"2.16.840.1.113883.4.642.1.1052",FormCodes,Form Codes,"This value set includes a sample set of Forms codes.","ValueSet/forms"
http://terminology.hl7.org/CodeSystem/fundsreserve,1.0.1,active,"2.16.840.1.113883.4.642.1.1051",FundsReservationCodes,Funds Reservation Codes,"This value set includes sample funds reservation type codes.","ValueSet/fundsreserve"
http://terminology.hl7.org/CodeSystem/goal-achievement,1.0.1,active,"2.16.840.1.113883.4.642.1.1375",GoalAchievementStatus,Goal achievement status,"Describes the progression, or lack thereof, towards the goal against the target.","ValueSet/goal-achievement"
http://terminology.hl7.org/CodeSystem/goal-category,2.0.0,active,"2.16.840.1.113883.4.642.1.1097",GoalCategory,Goal category,"Codes for grouping goals to use for filtering or presentation.","ValueSet/goal-category"
http://terminology.hl7.org/CodeSystem/goal-priority,1.0.1,active,"2.16.840.1.113883.4.642.1.1096",GoalPriority,Goal priority,"Indicates the level of importance associated with reaching or sustaining a goal.","ValueSet/goal-priority"
http://terminology.hl7.org/CodeSystem/list-empty-reason,1.0.1,active,"2.16.840.1.113883.4.642.1.1106",ListEmptyReasons,List Empty Reasons,"General reasons for a list to be empty. Reasons are either related to a summary list (i.e. problem or medication list) or to a workflow related list (i.e. consultation list).","ValueSet/list-empty-reason"
http://terminology.hl7.org/CodeSystem/list-order,2.0.0,active,"2.16.840.1.113883.4.642.1.1107",ListOrderCodes,List Order Codes,"Base values for the order of item lists in resources.","ValueSet/list-order"
http://terminology.hl7.org/CodeSystem/location-physical-type,2.0.1,active,"2.16.840.1.113883.4.642.1.1108",LocationType,Location type,"This example value set defines a set of codes that can be used to indicate the physical form of the Location.  This includes several 'non physical' codes which are still considered a location.","ValueSet/location-physical-type"
http://terminology.hl7.org/CodeSystem/med-admin-perform-function,1.0.1,active,"2.16.840.1.113883.4.642.1.1112",MedicationAdministrationPerformerFunctionCodes,MedicationAdministration Performer Function Codes,"MedicationAdministration Performer Function Codes","ValueSet/med-admin-perform-function"
http://terminology.hl7.org/CodeSystem/medication-admin-category,4.0.1,draft,"2.16.840.1.113883.4.642.4.1111",MedicationAdministration Category Codes,Medication administration  category  codes,"MedicationAdministration Category Codes","ValueSet/medication-admin-category"
http://terminology.hl7.org/CodeSystem/medication-admin-status,4.0.1,draft,"2.16.840.1.113883.4.642.4.1311",MedicationAdministration Status Codes,Medication administration  status  codes,"MedicationAdministration Status Codes","ValueSet/medication-admin-status"
http://terminology.hl7.org/CodeSystem/missingtoothreason,1.0.1,active,"2.16.840.1.113883.4.642.1.1150",MissingToothReasonCodes,Missing Tooth Reason Codes,"This value set includes sample Missing Tooth Reason codes.","ValueSet/missing-tooth-reason"
http://terminology.hl7.org/CodeSystem/modifiers,1.0.1,active,"2.16.840.1.113883.4.642.1.1151",ModifierTypeCodes,Modifier type Codes,"This value set includes sample Modifier type codes.","ValueSet/claim-modifiers"
http://terminology.hl7.org/CodeSystem/observation-category,2.0.0,active,"2.16.840.1.113883.4.642.1.1125",ObservationCategoryCodes,Observation Category Codes,"Observation Category codes.","ValueSet/category-code-tw,ValueSet/observation-category"
http://terminology.hl7.org/CodeSystem/operation-outcome,4.0.0,active,"2.16.840.1.113883.4.642.1.1127",OperationOutcomeCodes,Operation Outcome Codes,"Operation Outcome codes used by FHIR test servers (see Implementation file translations.xml)","ValueSet/operation-outcome"
http://terminology.hl7.org/CodeSystem/organization-type,2.0.1,active,"2.16.840.1.113883.4.642.1.1128",OrganizationType,Organization type,"This example value set defines a set of codes that can be used to indicate a type of organization.","ValueSet/organization-type"
http://terminology.hl7.org/CodeSystem/payeetype,1.0.1,active,"2.16.840.1.113883.4.642.1.1050",ClaimPayeeTypeCodes,Payee Type Codes,"Codes indicating the type of party to be reimbursed for cost of products and services.","ValueSet/payeetype"
http://terminology.hl7.org/CodeSystem/payment-adjustment-reason,1.0.1,active,"2.16.840.1.113883.4.642.1.1173",PaymentAdjustmentReasonCodes,Payment Adjustment Reason Codes,"This value set includes smattering of Payment Adjustment Reason codes.","ValueSet/payment-adjustment-reason"
http://terminology.hl7.org/CodeSystem/processpriority,1.0.1,active,"2.16.840.1.113883.4.642.1.1155",ProcessPriorityCodes,Process Priority Codes,"This value set includes the financial processing priority codes.","ValueSet/process-priority"
http://terminology.hl7.org/CodeSystem/reason-medication-given,1.0.1,active,"2.16.840.1.113883.4.642.1.1110",ReasonMedicationGivenCodes,Reason Medication Given Codes,"This value set is provided as an example. The value set to instantiate this attribute should be drawn from a robust terminology code system that consists of or contains concepts to support the medication process.","ValueSet/reason-medication-given-codes"
http://terminology.hl7.org/CodeSystem/referencerange-meaning,1.0.1,active,"2.16.840.1.113883.4.642.1.1124",ObservationReferenceRangeMeaningCodes,Observation Reference Range Meaning Codes,"This value set defines a set of codes that can be used to indicate the meaning/use of a reference range for a particular target population.","ValueSet/referencerange-meaning"
http://terminology.hl7.org/CodeSystem/v2-0116,3.0.0,active,"2.16.840.1.113883.18.47",BedStatus,bedStatus,"Code system of concepts which specify the state of a bed in an inpatient setting, and is used to determine if a patient may be assigned to it or not.  Used in HL7 Version 2.x messaging in the DLD and PV1 segments.","ValueSet/v2-0116"
http://terminology.hl7.org/CodeSystem/v2-0131,3.0.0,active,"2.16.840.1.113883.18.58",ContactRole2,contactRole2,"Code system of concepts which specify a relationship role that the next of kin/associated parties plays with regard to the patient. Also used in referrals, for example, it may be necessary to identify the contact representative at the clinic that sent a referral. Used in HL7 Version 2 messaging in the NK1 and CTD segments after 2.5, when it replace 2.16.840.1.113883.18.57.","ValueSet/RelationshipTypeVS-TWLTC,ValueSet/relatedperson-relationshiptype"
http://terminology.hl7.org/CodeSystem/v2-0203,5.0.0,active,"2.16.840.1.113883.18.108",IdentifierType,identifierType,"HL7-defined code system of concepts specifying type of identifier. Used in HL7 Version 2.x messaging data types CX, PLN, PPN, XCN and XON.","ValueSet/identifier-type,ValueSet/identifier-type-tw"
http://terminology.hl7.org/CodeSystem/v3-ActCode,10.0.0,active,"2.16.840.1.113883.5.4",ActCode,ActCode,"A code specifying the particular kind of Act that the Act-instance represents within its class.    *Constraints:* The kind of Act (e.g. physical examination, serum potassium, inpatient encounter, charge financial transaction, etc.) is specified with a code from one of several, typically external, coding systems. The coding system will depend on the class of Act, such as LOINC for observations, etc.    Conceptually, the Act.code must be a specialization of the Act.classCode. This is why the structure of ActClass domain should be reflected in the superstructure of the ActCode domain and then individual codes or externally referenced vocabularies subordinated under these domains that reflect the ActClass structure.    Act.classCode and Act.code are not modifiers of each other but the Act.code concept should really imply the Act.classCode concept. For a negative example, it is not appropriate to use an Act.code ""potassium"" together with and Act.classCode for ""laboratory observation"" to somehow mean ""potassium laboratory observation"" and then use the same Act.code for ""potassium"" together with Act.classCode for ""medication"" to mean ""substitution of potassium"". This mutually modifying use of Act.code and Act.classCode is not permitted.","ValueSet/v3-ActIncidentCode,ValueSet/v3-ActCode"
http://terminology.hl7.org/CodeSystem/v3-Confidentiality,4.0.0,active,"2.16.840.1.113883.5.25",Confidentiality,Confidentiality,"A set of codes specifying the security classification of acts and roles in accordance with the definition for concept domain ""Confidentiality"".","ValueSet/v3-ConfidentialityClassification"
http://terminology.hl7.org/CodeSystem/v3-MaritalStatus,4.0.0,active,"2.16.840.1.113883.5.2",MaritalStatus,MaritalStatus,"\* \* \* No description supplied \* \* \*    *Open Issue:* The specific meanings of these codes can vary somewhat by jurisdiction and implementation so caution should be used when determining equivalency.    *Open Issue:* fixing and completion of the hierarchy and proper good definitions of all the concepts is badly needed.","ValueSet/marital-status"
http://terminology.hl7.org/CodeSystem/v3-NullFlavor,4.0.0,active,"2.16.840.1.113883.5.1008",NullFlavor,NullFlavor,"A collection of codes specifying why a valid value is not present.","ValueSet/marital-status"
http://terminology.hl7.org/CodeSystem/v3-ObservationInterpretation,4.0.0,active,"2.16.840.1.113883.5.83",ObservationInterpretation,ObservationInterpretation,"One or more codes providing a rough qualitative interpretation of the observation, such as ""normal"" / ""abnormal"", ""low"" / ""high"", ""better"" / ""worse"", ""resistant"" / ""susceptible"", ""expected"" / ""not expected"". The value set is intended to be for ANY use where coded representation of an interpretation is needed.","ValueSet/observation-interpretation"
http://terminology.hl7.org/CodeSystem/v3-ParticipationMode,5.0.0,active,"2.16.840.1.113883.5.1064",ParticipationMode,ParticipationMode,"A set of codes specifying the modality by which the Entity playing the Role is participating in the Act.    *Examples:* Physically present, over the telephone, written communication.    *Rationale:* Particularly for author (originator) participants this is used to specify whether the information represented by the act was initially provided verbally, (hand-)written, or electronically.    *Open Issue:* There needs to be a reexamination of the hierarchies as there seems to be some muddling between ELECTRONIC and other concepts that involve electronic communication that are in other hierarchies.","ValueSet/v3-ParticipationMode"
http://terminology.hl7.org/CodeSystem/v3-RoleCode,4.0.0,active,"2.16.840.1.113883.5.111",RoleCode,RoleCode,"A set of codes further specifying the kind of Role; specific classification codes for further qualifying RoleClass codes.","ValueSet/RelationshipTypeVS-TWLTC,ValueSet/relatedperson-relationshiptype,ValueSet/v3-ServiceDeliveryLocationRoleType"
http://unitsofmeasure.org,3.0.1,active,"2.16.840.1.113883.6.8",UCUM,Unified Code for Units of Measure (UCUM),"The Unified Code for Units of Measure (UCUM) is a code system intended to include all units of measures being contemporarily used in international science, engineering, and business. The purpose is to facilitate unambiguous electronic communication of quantities together with their units. The focus is on electronic communication, as opposed to communication between humans. A typical application of The Unified Code for Units of Measure are electronic data interchange (EDI) protocols, but there is nothing that prevents it from being used in other types of machine communication.","ValueSet/ucum-vitals-common"
https://twcore.mohw.gov.tw/ig/twcore/CodeSystem/category-code-tw,2024-08-31,active,,TWCategoryCode,臺灣衛福部資訊處類型代碼,"臺灣衛福部資訊處類型代碼，  代碼出版日期：2024-08-31；資料所屬單位：衛生福利部資訊處。   ","ValueSet/serviceRequest-category,ValueSet/category-code-tw"
https://twcore.mohw.gov.tw/ig/twcore/CodeSystem/health-professional-tw,2022-01-28,active,,TWHealthProfessional,臺灣醫事司醫事人員類別,"臺灣醫事司醫事人員類別，參照至[醫事人員基本資料檔](https://www.google.com/url?client=internal-element-cse&cx=012254495936870409035:lzvyrg0mtim&q=https://www.mohw.gov.tw/dl-40452-1441ca2e-cde9-4345-b681-f9a20d5176b5.html&sa=U&ved=2ahUKEwjg5MCYrZn5AhUTI6YKHV6mC_s4FBAWegQIBBAC&usg=AOvVaw1q62t2W0hhdi0WC6e_nh1m)中的「人員類別（2022/01/28修訂）」。  代碼出版日期：2022-01-28；資料所屬單位：衛生福利部醫事司。  *因原始資料無代碼版本資訊，故使用其「更新日期」作為版本資訊。*","ValueSet/health-professional-sct-tw"
https://twcore.mohw.gov.tw/ig/twcore/CodeSystem/icd-10-cm-2014-tw,2017-07-19,active,,TW2014ICD10CM,臺灣健保署2014年中文版ICD-10-CM,"臺灣健保署2014年中文版ICD-10-CM，參照至[國際疾病分類第 10 版](https://www.nhi.gov.tw/ch/np-3049-1.html)，由於資料會隨代碼更新而變動，本資料的來源位置可能已更新為最新版代碼，原資料已被覆蓋。     代碼出版日期：2022-07-19；資料所屬單位：衛生福利部中央健康保險署。  *因原始資料無代碼版本資訊，故使用其法規「公布日期」作為版本資訊。*  因代碼量較大會使載入頁面時間較長，為方便使用者瀏覽，此處(本頁、XML、JSON、TTL)僅擷取部分代碼，完整代碼可至[全國專門術語服務平臺－代碼系統(Code System)](https://fhir.mohw.gov.tw/ts/codesystem.jsp)查閱  ","ValueSet/icd-10-cm-2014-tw"
https://twcore.mohw.gov.tw/ig/twcore/CodeSystem/icd-10-cm-2021-tw,2022-07-29,active,,TW2021ICD10CM,臺灣健保署2021年中文版ICD-10-CM,"臺灣健保署2021年中文版ICD-10-CM，參照至[國際疾病分類第 10 版](https://www.nhi.gov.tw/ch/np-3049-1.html)，由於資料會隨代碼更新而變動，本資料的來源位置可能已更新為最新版代碼，原資料已被覆蓋。       代碼出版日期：2022-07-29；資料所屬單位：衛生福利部中央健康保險署。  *因原始資料無代碼版本資訊，故使用其法規「公布日期」作為版本資訊。*  因代碼量較大會使載入頁面時間較長，為方便使用者瀏覽，此處(本頁、XML、JSON、TTL)僅擷取部分代碼，完整代碼可至[全國專門術語服務平臺－代碼系統(Code System)](https://fhir.mohw.gov.tw/ts/codesystem.jsp)查閱  ","ValueSet/icd-10-cm-2021-tw"
https://twcore.mohw.gov.tw/ig/twcore/CodeSystem/icd-10-cm-2023-tw,2024-11-18,active,,TW2023ICD10CM,臺灣健保署2023年中文版ICD-10-CM,"臺灣健保署2023年中文版ICD-10-CM，參照至[國際疾病分類第 10 版](https://www.nhi.gov.tw/ch/np-3049-1.html)，由於資料會隨代碼更新而變動，本資料的來源位置可能已更新為最新版代碼，原資料已被覆蓋。       代碼出版日期：2024-01-31；資料所屬單位：衛生福利部中央健康保險署。  *因原始資料無代碼版本資訊，故使用其法規「公布日期」作為版本資訊。*  因代碼量較大會使載入頁面時間較長，為方便使用者瀏覽，此處(本頁、XML、JSON、TTL)僅擷取部分代碼，完整代碼可至[全國專門術語服務平臺－代碼系統(Code System)](https://fhir.mohw.gov.tw/ts/codesystem.jsp)查閱  ","ValueSet/icd-10-cm-2023-tw"
https://twcore.mohw.gov.tw/ig/twcore/CodeSystem/icd-10-pcs-2014-tw,2017-07-19,active,,TW2014ICD10PCS,臺灣健保署2014年中文版ICD-10-PCS,"臺灣健保署2014年中文版ICD-10-PCS，參照至[國際疾病分類第 10 版](https://www.nhi.gov.tw/ch/np-3049-1.html)，由於資料會隨代碼更新而變動，本資料的來源位置可能已更新為最新版代碼，原資料已被覆蓋。   代碼出版日期：2017-07-19；資料所屬單位：衛生福利部中央健康保險署。  *因原始資料無代碼版本資訊，故使用其法規「公布日期」作為版本資訊。*  因代碼量較大會使載入頁面時間較長，為方便使用者瀏覽，此處(本頁、XML、JSON、TTL)僅擷取部分代碼，完整代碼可至[全國專門術語服務平臺－代碼系統(Code System)](https://fhir.mohw.gov.tw/ts/codesystem.jsp)查閱  ","ValueSet/icd-10-pcs-2014-tw"
https://twcore.mohw.gov.tw/ig/twcore/CodeSystem/icd-10-pcs-2021-tw,2022-07-29,active,,TW2021ICD10PCS,臺灣健保署2021年中文版ICD-10-PCS,"臺灣健保署2021年中文版ICD-10-PCS，參照至[國際疾病分類第 10 版](https://www.nhi.gov.tw/ch/np-3049-1.html)，由於資料會隨代碼更新而變動，本資料的來源位置可能已更新為最新版代碼，原資料已被覆蓋。        代碼出版日期：2022-07-29；資料所屬單位：衛生福利部中央健康保險署。  *因原始資料無代碼版本資訊，故使用其法規「公布日期」作為版本資訊。*  因代碼量較大會使載入頁面時間較長，為方便使用者瀏覽，此處(本頁、XML、JSON、TTL)僅擷取部分代碼，完整代碼可至[全國專門術語服務平臺－代碼系統(Code System)](https://fhir.mohw.gov.tw/ts/codesystem.jsp)查閱  ","ValueSet/icd-10-pcs-2021-tw"
https://twcore.mohw.gov.tw/ig/twcore/CodeSystem/icd-10-pcs-2023-tw,2024-11-18,active,,TW2023ICD10PCS,臺灣健保署2023年中文版ICD-10-PCS,"臺灣健保署2023年中文版ICD-10-PCS，參照至[國際疾病分類第 10 版](https://www.nhi.gov.tw/ch/np-3049-1.html)，由於資料會隨代碼更新而變動，本資料的來源位置可能已更新為最新版代碼，原資料已被覆蓋。       代碼出版日期：2024-01-31；資料所屬單位：衛生福利部中央健康保險署。  *因原始資料無代碼版本資訊，故使用其法規「公布日期」作為版本資訊。*  因代碼量較大會使載入頁面時間較長，為方便使用者瀏覽，此處(本頁、XML、JSON、TTL)僅擷取部分代碼，完整代碼可至[全國專門術語服務平臺－代碼系統(Code System)](https://fhir.mohw.gov.tw/ts/codesystem.jsp)查閱  ","ValueSet/icd-10-pcs-2023-tw"
https://twcore.mohw.gov.tw/ig/twcore/CodeSystem/icd-9-cm-2001-tw,2023-05-09,active,,TW2001ICD9CM,臺灣健保署2001年中文版ICD-9-CM,"臺灣健保署2001年中文版ICD-9-CM，參照至[國際疾病分類第 10 版](https://www.nhi.gov.tw/ch/np-3049-1.html)，由於資料會隨代碼更新而變動，本資料的來源位置可能已更新為最新版代碼，原資料已被覆蓋。   代碼出版日期：2023-05-09；資料所屬單位：衛生福利部中央健康保險署。  *因原始資料無代碼版本資訊，故使用其「更新日期」作為版本資訊。*  因代碼量較大會使載入頁面時間較長，為方便使用者瀏覽，此處(本頁、XML、JSON、TTL)僅擷取部分代碼，完整代碼可至[全國專門術語服務平臺－代碼系統(Code System)](https://fhir.mohw.gov.tw/ts/codesystem.jsp)查閱  ","ValueSet/icd-9-cm-2001-tw"
https://twcore.mohw.gov.tw/ig/twcore/CodeSystem/medical-consultation-department-nhi-tw,2024-05-27,active,,TWMedicalConsultationDepartmentNHI,臺灣健保署就醫科別,"臺灣健保署就醫科別，參照至[健保署檔案譯碼簿](https://www.nhi.gov.tw/ch/cp-1880-20811-3142-1.html)中的「就醫科別（2022/8/2版本）」。  代碼出版日期：2024-05-27；資料所屬單位：衛生福利部中央健康保險署。  *因原始資料無代碼版本資訊，故使用其「更新日期」作為版本資訊。*","ValueSet/medical-consultation-department-tw"
