URL,Version,Status,OIDs,Name,Title,Description,Used
http://hl7.org/fhir/care-team-status,4.0.1,draft,"2.16.840.1.113883.4.642.4.154",CareTeamStatus,CareTeamStatus,"Indicates the status of the care team.","ValueSet/care-team-status"
http://hl7.org/fhir/publication-status,4.0.1,active,"2.16.840.1.113883.4.642.4.4",PublicationStatus,PublicationStatus,"The lifecycle status of an artifact.","ValueSet/publication-status"
http://loinc.org,3.1.0,active,"2.16.840.1.113883.6.1",LOINC,Logical Observation Identifiers, Names and Codes (LOINC),"LOINC provides a set of universal names and ID codes for identifying laboratory and clinical test results.1,2 LOINC facilitates the exchange and pooling of results, such as blood hemoglobin, serum potassium, or vital signs, for clinical care, outcomes management, and research. LOINC's universal identifiers (names and codes) can be used in the context of order and observation exchanges between information systems that use syntax standards such as HL73, CEN TC251, ISO TC215, ASTM4, and DICOM. Specifically, the identifier can be used as the coded value for an observation in any other standard that uses the observation/observation value paradigm, whether messages, documents, application programming interface (API), etc. For example, LOINC codes are used widely in the OBX segment Observation Identifier field (OBX-3) of an ORU HL7 (HL7 version 2.x or ASTM 1238-9410) message that may be sent between a Clinical Laboratory Information Management Systems (LIMS) and Electronic Health Record Systems (EHR).5, 6 In this way, LOINC codes provide universal identifiers that allow the exchange of clinical data between heterogeneous computing environments.","ValueSet/FallHistoryResultVS-TWLTC,ValueSet/GoalDescriptionVS-TWLTC"
http://ltc-ig.fhir.tw/CodeSystem/AddressUseCS-TWLTC,0.2.0,active,,AddressUseCSTWLTC,地址用途擴展識別碼,"地址用途的擴展識別碼，新增戶籍地與現居地等代碼","ValueSet/AddressUseVS-TWLTC"
http://ltc-ig.fhir.tw/CodeSystem/ConditionDisabilityCS-TWLTC,0.2.0,active,,ConditionDisabilityCSTWLTC,個案身心障礙手冊持有狀態代碼,"用於表述個案的身心障礙手冊持有狀態代碼。","ValueSet/ConditionDisabilityVS-TWLTC"
http://ltc-ig.fhir.tw/CodeSystem/ConditionDisabilityLegacyTypeCS-TWLTC,0.2.0,active,,ConditionDisabilityLegacyTypeCSTWLTC,個案身心障礙類型代碼（舊制）,"用於表述個案的身心障礙類型代碼（舊制）。","ValueSet/ConditionDisabilityTypeVS-TWLTC"
http://ltc-ig.fhir.tw/CodeSystem/ConditionDisabilityTypeCS-TWLTC,0.2.0,active,,ConditionDisabilityTypeCSTWLTC,個案身心障礙類型代碼（新制）,"用於表述個案的身心障礙類型代碼（新制）。","ValueSet/ConditionDisabilityTypeVS-TWLTC"
http://ltc-ig.fhir.tw/CodeSystem/EconomyStatusCS-TWLTC,0.2.0,active,,EconomyStatusCSTWLTC,經濟狀況代碼,"用於表述個案的經濟狀況，在長照機構住民經濟狀況 Extension 中使用。 此代碼比照警政署偵查筆錄制式格式之選項進行設計。","ValueSet/EconomyStatusVS-TWLTC"
http://ltc-ig.fhir.tw/CodeSystem/EducationStatusCS-TWLTC,0.2.0,active,,EducationStatusCSTWLTC,教育程度代碼,"用於表述個案的教育程度，在長照機構住民教育程度 Extension 中使用。","ValueSet/EducationStatusVS-TWLTC"
http://ltc-ig.fhir.tw/CodeSystem/GaitCycleCS-Sport,0.2.0,active,,GaitCycleCSSport,身體活動量測-步態週期,"一個步伐的完整過程，從一隻腳接觸地面開始到同一隻腳再次接觸地面結束。這個過程可以分為兩個主要階段：支撐期（stance phase）和擺動期（swing phase）。本 CodeSystem 繼承自身體活動量測 IG，後續將配合原始 IG 進行更新。","ValueSet/GaitCycleVS-Sport"
http://ltc-ig.fhir.tw/CodeSystem/ICD-10-PCS-2023-TW-F-CS,0.2.0,active,,ICD10PCS2023TWFCS,臺灣 2023 年中文版 ICD-10-PCS-F-復健及診斷性聽力學,"臺灣 2023 年中文版 ICD-10-PCS 復健及診斷性聽力學(Physical Rehabilitation and Diagnostic Audiology)，章節數值為「F」。 包括：復健、診斷性聽力學。 代碼出版日期：2023-11-10；資料所屬單位：衛生福利部中央健康保險署。 因原始資料無代碼版本資訊，故使用其法規「公布日期」作為版本資訊。本 CodeSystem 繼承自身體活動量測 IG，後續將配合原始 IG 進行更新。","ValueSet/ICD-10-PCS-2023-TW-F-VS"
http://ltc-ig.fhir.tw/CodeSystem/PatientIdentityCS-TWLTC,0.2.0,active,,PatientIdentityCSTWLTC,個案身分別代碼,"個案身分別代碼","ValueSet/PatientIdentityVS-TWLTC"
http://ltc-ig.fhir.tw/CodeSystem/ReferralCarePlanCS-TWLTC,0.2.0,active,,ReferralCarePlanCSTWLTC,轉介單申請服務種類代碼,"用於表述個案欲申請的服務項目。","ValueSet/ReferralCarePlanVS-TWLTC"
http://ltc-ig.fhir.tw/CodeSystem/ReferralConditionCaregiverCS-TWLTC,0.2.0,active,,ReferralConditionCaregiverCSTWLTC,轉介單看護狀況代碼,"用於表述個案雇用看護的狀況。","ValueSet/ReferralConditionCaregiverVS-TWLTC"
http://ltc-ig.fhir.tw/CodeSystem/ReferralConditionCrushCS-TWLTC,0.2.0,active,,ReferralConditionCrushCSTWLTC,轉介單壓傷狀況代碼,"用於表述個案的壓傷狀況。","ValueSet/ReferralConditionCrushVS-TWLTC"
http://ltc-ig.fhir.tw/CodeSystem/ReferralConditionResidenceCS-TWLTC,0.2.0,active,,ReferralConditionResidenceCSTWLTC,轉介單居住狀況代碼,"用於表述個案的居住狀況","ValueSet/ReferralConditionResidenceVS-TWLTC"
http://ltc-ig.fhir.tw/CodeSystem/ReferralConditionTubeCS-TWLTC,0.2.0,active,,ReferralConditionTubeCSTWLTC,轉介單管路狀況代碼,"用於表述轉介單的狀況代碼，包含身心障礙手冊、管路、壓傷、居住狀況、看護、主要問題及需求等。","ValueSet/ReferralConditionTubeVS-TWLTC"
http://ltc-ig.fhir.tw/CodeSystem/RelationshipTypeCS-TWLTC,0.2.0,active,,RelationshipTypeCSTWLTC,關係類型擴展代碼,"關係人與個案的關係類型擴展代碼，新增孫媳婦、孫女婿、聘用看護-本國籍、聘用看護-外國籍等代碼","ValueSet/RelationshipTypeVS-TWLTC"
http://ltc-ig.fhir.tw/CodeSystem/SportTrainingCS-Sport,0.2.0,active,,SportTrainingCS,身體活動量測-重量訓練代碼系統,"此代碼系統定義重量訓練各個方面的代碼，包括使用的重量、執行的組數以及每組的重複次數。本 CodeSystem 繼承自身體活動量測 IG，後續將配合原始 IG 進行更新。","ValueSet/SportTrainingVS-Sport"
http://ltc-ig.fhir.tw/CodeSystem/TempCodeCS-Sport,0.2.0,active,,TempCodeCSSport,身體活動量測-暫用代碼,"身體活動量測暫時使用的代碼，目前無官方代碼。本 CodeSystem 繼承自身體活動量測 IG，後續將配合官方代碼更新。","ValueSet/TempCodeVS-Sport"
http://snomed.info/sct,null,active,"2.16.840.1.113883.6.96",SNOMED_CT,SNOMED CT (all versions),"SNOMED CT is the most comprehensive and precise clinical health terminology product in the world, owned and distributed around the world by The International Health Terminology Standards Development Organisation (IHTSDO).","ValueSet/medication-codes,ValueSet/participant-role,ValueSet/observation-methods,ValueSet/route-codes,ValueSet/body-site,ValueSet/GoalDescriptionVS-TWLTC"
http://terminology.hl7.org/CodeSystem/medication-admin-status,4.0.1,draft,"2.16.840.1.113883.4.642.4.1311",MedicationAdministration Status Codes,Medication administration  status  codes,"MedicationAdministration Status Codes","ValueSet/medication-admin-status"
http://terminology.hl7.org/CodeSystem/observation-category,1.0.1,active,"2.16.840.1.113883.4.642.1.1125",ObservationCategoryCodes,Observation Category Codes,"Observation Category codes.","ValueSet/category-code-tw"
http://terminology.hl7.org/CodeSystem/v2-0131,2.1.0,active,"2.16.840.1.113883.18.58",ContactRole2,contactRole2,"Code system of concepts which specify a relationship role that the next of kin/associated parties plays with regard to the patient. Also used in referrals, for example, it may be necessary to identify the contact representative at the clinic that sent a referral. Used in HL7 Version 2 messaging in the NK1 and CTD segments after 2.5, when it replace 2.16.840.1.113883.18.57.","ValueSet/RelationshipTypeVS-TWLTC"
http://terminology.hl7.org/CodeSystem/v3-RoleCode,3.0.0,active,"2.16.840.1.113883.5.111",RoleCode,RoleCode,"A set of codes further specifying the kind of Role; specific classification codes for further qualifying RoleClass codes.","ValueSet/RelationshipTypeVS-TWLTC"
https://twcore.mohw.gov.tw/ig/twcore/CodeSystem/category-code-tw,2024-08-31,active,,TWCategoryCode,臺灣衛福部資訊處類型代碼,"臺灣衛福部資訊處類型代碼，  代碼出版日期：2024-08-31；資料所屬單位：衛生福利部資訊處。   ","ValueSet/category-code-tw"
